{
  "$schema": "https://json-schema.org/draft/2020-12/schema",
  "$id": "https://parallax.invalid/runner/v1/result.schema.json",
  "title": "Parallax harness result (protocol v1)",
  "description": "The single JSON document the harness writes to the container's stdout, framed by the job nonce (docs/design/runner.md \u00a74.4). The runner validates it before trusting any field, then wraps it in the outcome it sends as an `execution.result` message.",
  "type": "object",
  "required": ["v", "harnessVersion", "runtime", "checks", "truncated", "durationMs"],
  "additionalProperties": false,
  "properties": {
    "v": {
      "const": 1
    },
    "harnessVersion": {
      "description": "Integer version of runner/harness, as a string; part of the grader version.",
      "type": "string",
      "pattern": "^[0-9]+$"
    },
    "runtime": {
      "type": "object",
      "required": ["language", "version"],
      "additionalProperties": false,
      "properties": {
        "language": {
          "enum": ["python", "r"]
        },
        "version": {
          "description": "Interpreter version as reported by it, e.g. 3.12.8 or 4.6.1.",
          "type": "string",
          "maxLength": 64
        }
      }
    },
    "compileError": {
      "description": "Present when a file failed to parse before any check ran; every check is then `skipped`.",
      "type": "object",
      "required": ["file", "message"],
      "additionalProperties": false,
      "properties": {
        "file": {
          "type": "string",
          "maxLength": 200
        },
        "line": {
          "type": "integer",
          "minimum": 1
        },
        "message": {
          "type": "string",
          "maxLength": 2048
        }
      }
    },
    "checks": {
      "description": "One entry per job check, in job order, names copied from the job.",
      "type": "array",
      "minItems": 1,
      "maxItems": 50,
      "items": {
        "$ref": "#/$defs/checkResult"
      }
    },
    "truncated": {
      "description": "True when any captured stdout or stderr was cut at its cap.",
      "type": "boolean"
    },
    "durationMs": {
      "description": "Wall time from harness start to result, including the compile phase.",
      "type": "integer",
      "minimum": 0
    }
  },
  "$defs": {
    "checkResult": {
      "type": "object",
      "required": ["name", "status", "durationMs", "stdout", "stderr", "truncated"],
      "additionalProperties": false,
      "properties": {
        "name": {
          "type": "string",
          "pattern": "^[A-Za-z0-9][A-Za-z0-9 ._-]{0,63}$"
        },
        "status": {
          "description": "`passed`/`failed`: the program ran and the comparison decided. `error`: it did not run to a comparable end (exception, exit code, signal, memory, could not start). `timeout`: killed at its time cap. `skipped`: not run (compile error or budget already spent).",
          "enum": ["passed", "failed", "error", "timeout", "skipped"]
        },
        "errorKind": {
          "description": "Only with status `error`. `exception`: uncaught exception in a call check. `exit`: unexpected exit code. `signal`: killed by a signal other than the memory killer. `memory`: killed while the cgroup recorded an out-of-memory kill. `spawn`: the process could not be started (for example the pids limit). `harness`: a harness fault for this check.",
          "enum": ["exception", "exit", "signal", "memory", "spawn", "harness"]
        },
        "durationMs": {
          "type": "integer",
          "minimum": 0
        },
        "expected": {
          "description": "Human-readable expectation (JSON, repr or stdout excerpt), at most 2048 characters, cut with an ellipsis.",
          "type": "string",
          "maxLength": 2048
        },
        "actual": {
          "description": "What the program produced, in the same form as `expected`.",
          "type": "string",
          "maxLength": 2048
        },
        "message": {
          "description": "One line for the student, e.g. `Expected 1.290994, received None` or `Line 2 differs`.",
          "type": "string",
          "maxLength": 512
        },
        "exitCode": {
          "type": "integer",
          "minimum": 0,
          "maximum": 255
        },
        "signal": {
          "type": "integer",
          "minimum": 1,
          "maximum": 64
        },
        "stdout": {
          "description": "Captured text, cut when the job's outputBytes budget is spent (`truncated`); at most 4 MiB, the largest outputBytes.",
          "type": "string",
          "maxLength": 4194304
        },
        "stderr": {
          "description": "Captured text, cut when the job's outputBytes budget is spent (`truncated`); at most 4 MiB, the largest outputBytes.",
          "type": "string",
          "maxLength": 4194304
        },
        "truncated": {
          "type": "boolean"
        }
      },
      "if": {
        "properties": {
          "status": {
            "const": "error"
          }
        }
      },
      "then": {
        "required": ["errorKind"]
      },
      "else": {
        "not": {
          "required": ["errorKind"]
        }
      }
    }
  }
}
